{
  "schema": "neuestar.report/v2",
  "artifact": {
    "outer_archive_sha256": "a5773bc2b1cec810a6767aa2eb561791f3ab6c312b90afa4dac11e103c9c10fe",
    "payload_manifest_sha256": "b6f127341d019da391e6cc60cc1d432fde12f8e27602a61ff5e288aafedd0f8e",
    "source_commit": "06adad5e83f1e31000bdbb44c693a3ece3dc5a6f",
    "probe_version": "0.2.0"
  },
  "matrix_cell": {
    "distro": "nixos",
    "gpu_vendor": "nvidia",
    "display_server": "wayland"
  },
  "observed_host": {
    "distro_id": "nixos:26.05",
    "distro_version": "26.05",
    "kernel_release": "6.18.44",
    "architecture": "x86_64",
    "gpu_description": "not-observed-phase-1",
    "display_server": "wayland",
    "current_desktop": "GNOME",
    "desktop_session": "gnome"
  },
  "containment": {
    "namespace_constructed": true,
    "user_namespace_constructed": true,
    "mount_namespace_constructed": true,
    "user_namespace_id": "user:[4026532492]",
    "mount_namespace_id": "mnt:[4026532491]",
    "host_paths_exposed": [
      "/home/lab/c2-nixos-2026-08-16/neuestar-probe/root",
      "/home/lab/c2-nixos-2026-08-16/neuestar-probe/app",
      "/home/lab/c2-nixos-2026-08-16/neuestar-probe"
    ]
  },
  "runtime": {
    "libc_source": "controlled",
    "libc_path": "/lib/x86_64-linux-gnu/libc.so.6",
    "libc_version": "ld.so (Ubuntu GLIBC 2.39-0ubuntu8.8) stable release version 2.39.",
    "host_glibc_imported": false,
    "interpreter": "/lib64/ld-linux-x86-64.so.2",
    "loader_diagnostics": [
      "/lib/x86_64-linux-gnu/libc.so.6"
    ]
  },
  "graphics": {
    "renderer": "not-determined",
    "renderer_description": "not-run-phase-1",
    "device": "not-run-phase-1",
    "software_renderer_detected": false,
    "vendor_specific_rules": [
      {
        "category": "nvidia-device-nodes",
        "description": "Expose only concrete NVIDIA device nodes discovered on the physical host"
      }
    ]
  },
  "presentation": {
    "frames_requested": 0,
    "frames_presented": 0,
    "validation_errors": 0,
    "device_loss": false
  },
  "capture": {
    "capture_rule_sha256": "6f71fc1be6700a767903a4509cbdcd5e7a8eee297e31e3df7ea390938edfc355",
    "dependency_count": 0,
    "vendor_specific_rule_count": 1,
    "distro_specific_rule_count": 0,
    "host_path_count": 3
  },
  "gates": {
    "l0_0_containment": "pass",
    "l0_1_launch": "pass",
    "l0_2_acceleration": "not-run",
    "l0_3_present": "not-run",
    "l0_4_churn": "not-run",
    "l0_5_maintenance": "not-run"
  },
  "classification": "fail",
  "failure": {
    "stage": "graphics",
    "code": "graphics-not-implemented",
    "message": "Phase 1 established containment and controlled-glibc launch; graphics is not implemented"
  }
}